Name,F.year,Address,States,City,County,Type,latitude,longitude,geocode_source,geocode_input,matched_address,match_type
National Hispanic Institute,1979,"472 Fm 1966 Maxwell, TX 78656-0000 ",TX,MAXWELL,CALDWELL,CSO,29.883878,-97.799585,geocodio,"472 Fm 1966 Maxwell, TX 78656-0000","472 Farm To Market Rd 1966, Maxwell, TX 78656",1
Hispanic Learning and Resource Center,2008,"1108 W Main St,Medford, Oregon 97501-2933",OR,MEDFORD,JACKSON,CSO,42.323859,-122.883586,geocodio,"1108 W Main St,Medford, Oregon 97501-2933","1108 W Main St, Medford, OR 97501",1
Latino Memphis,1995,"6041 Mt. Moriah Extended, Suite 16, Memphis, TN 38115-0000",TN,MEMPHIS,SHELBY,Hybrid,35.071403,-89.862606,geocodio,"6041 Mt. Moriah Extended, Suite 16, Memphis, TN 38115-0000","6041 Mt Moriah Ext, Ste 16, Memphis, TN 38115",1
Hispanic Forum of Mesquite,2005,,TX,MESQUITE,DALLAS,Hybrid,32.777779,-96.62315,geocodio,"MESQUITE, TX","Mesquite, TX 75149",1
Florida Hispanic Foundation,2006,,FL,MIAMI,MIAMI-DADE,CSO,25.558428,-80.458168,geocodio,"MIAMI, FL","Miami, FL 33234",1
Hispanic Food and Beverage Foundation,2010,,FL,MIAMI,MIAMI-DADE,CSO,25.558428,-80.458168,geocodio,"MIAMI, FL","Miami, FL 33234",1
Hispanic National Bar Foundation,1985,"9195 SW 72nd Street, Miami, FL 33173",FL,MIAMI,MIAMI-DADE,CSO,25.702592,-80.341843,geocodio,"9195 SW 72nd Street, Miami, FL 33173","9195 SW 72nd St, Miami, FL 33173",1
Hispanic Transit Society of Dade County,1967,"Miami, FL 33144-1778",FL,MIAMI,MIAMI-DADE,Advocacy,25.763484,-80.312095,geocodio,"Miami, FL 33144-1778","Miami, FL 33144",1
Latino Children Fund,1997,,FL,MIAMI,MIAMI-DADE,CSO,25.558428,-80.458168,geocodio,"MIAMI, FL","Miami, FL 33234",1
Alianza Latina Aplicando Soluciones,1997,"1615 S 22nd St, Milwaukee, WI 53204",WI,MILWAUKEE,MILWAUKEE,Hybrid,43.013705,-87.941255,geocodio,"1615 S 22nd St, Milwaukee, WI 53204","1615 S 22nd St, Milwaukee, WI 53204",1
Latino Community Center,1999,"807 S 14th St, Milwaukee, Wisconsin 53204",WI,MILWAUKEE,MILWAUKEE,CSO,43.022903,-87.929709,geocodio,"807 S 14th St, Milwaukee, Wisconsin 53204","807 S 14th St, Milwaukee, WI 53204",1
Wisconsin Hispanic Scholarship Foundation,1962,"2997 S 20TH ST, MILWAUKEE, WI 53215",WI,MILWAUKEE,MILWAUKEE,CSO,42.990364,-87.939416,geocodio,"2997 S 20TH ST, MILWAUKEE, WI 53215","2997 S 20th St, Milwaukee, WI 53215",1
Centro Cultural Chicano,1974,"1915 Chicago Avenue, Minneapolis, MN 55404",MN,MINNEAPOLIS,HENNEPIN,CSO,44.963484,-93.262118,geocodio,"1915 Chicago Avenue, Minneapolis, MN 55404","1915 Chicago Ave, Minneapolis, MN 55404",1
Latino Economic Development Center,1991,"1501 E Lake St Lower Level Minneapolis, MN 55407-1789 ",MN,MINNEAPOLIS,HENNEPIN,CSO,44.948364,-93.253784,geocodio,"1501 E Lake St Lower Level Minneapolis, MN 55407-1789","1501 E Lake St, Minneapolis, MN 55407",1
Latino Youth Development Collaborative Lydc,2016,,MN,MINNEAPOLIS,HENNEPIN,CSO,44.984577,-93.269097,geocodio,"MINNEAPOLIS, MN","Minneapolis, MN 55401",1
Latino Community Roundtable,1997,,CA,MODESTO,STANISLAUS,Advocacy,37.669463,-121.016796,geocodio,"MODESTO, CA","Modesto, CA 95350",1
Latino Emergency Council,2006,,CA,MODESTO,STANISLAUS,CSO,37.669463,-121.016796,geocodio,"MODESTO, CA","Modesto, CA 95350",1
Asociacion Latino Americana de Cirujanos de Catarata Y Segmento,2001,,CA,MONTEBELLO,LOS ANGELES,CSO,34.00946,-118.10535,geocodio,"MONTEBELLO, CA","Montebello, CA 90640",1
Latino Diabetes Association,2004,"Montebello, CA 90640-1347",CA,MONTEBELLO,LOS ANGELES,CSO,34.00946,-118.10535,geocodio,"Montebello, CA 90640-1347","Montebello, CA 90640",1
Latino Kids Health,2014,,CA,MONTEBELLO,LOS ANGELES,CSO,34.00946,-118.10535,geocodio,"MONTEBELLO, CA","Montebello, CA 90640",1
Mexican American Opportunity Foundation,1963,"401 N. Garfield Avenue, Montebello, CA 90640",CA,MONTEBELLO,LOS ANGELES,CSO,34.01922,-118.133723,geocodio,"401 N. Garfield Avenue, Montebello, CA 90640","401 N Garfield Ave, Montebello, CA 90640",1
Hispanic Alliance for Education,1996,,MD,MONTGOMERY VILLAGE,MONTGOMERY,CSO,39.187415,-77.207136,geocodio,"MONTGOMERY VILLAGE, MD","Montgomery Village, MD 20886",1
Hispanic Affairs Project,2005,,CO,MONTROSE,MONTROSE,Advocacy,38.484148,-107.770845,geocodio,"MONTROSE, CO","Montrose, CO 81401",1
Mexican American Development Association,1971,"17 North 6th Street, Montrose, CO 81401",CO,MONTROSE,MONTROSE,CSO,38.481603,-107.885976,geocodio,"17 North 6th Street, Montrose, CO 81401","17 N 6th St, Montrose, CO 81401",1
Latino Summit,2014,,IL,MT PROSPECT,COOK,CSO,42.062377,-87.931797,geocodio,"MT PROSPECT, IL","Mount Prospect, IL 60056",1
Centro Latino de Educacion Para Adultos de Dallas Norte,2005,,TX,MURPHY,COLLIN,CSO,30.351902,-104.018475,geocodio,"MURPHY, TX","Marfa, TX 79843",1
Hispanic Support Organization,2014,"27890 Clinton Keith Road D-466 Murrieta, CA 92562-8571",CA,MURRIETA,RIVERSIDE,CSO,33.599445,-117.175987,geocodio,"27890 Clinton Keith Road D-466 Murrieta, CA 92562-8571","27890 Clinton Keith Rd 466, Murrieta, CA 92562",1
Hispanic Community Services Coalition,2010,,MI,MUSKEGON,MUSKEGON,CSO,43.237691,-86.254186,geocodio,"MUSKEGON, MI","Muskegon, MI 49440",1
Napa County Hispanic Network,1983,"Napa, CA 94581",CA,NAPA,NAPA,Advocacy,38.509569,-122.3539,geocodio,"Napa, CA 94581","Napa, CA 94581",1
Hispanic Family Foundation,2014,"3927 Nolensville Pk, Nashville, TN 37211",TN,NASHVILLE,DAVIDSON,CSO,36.085338,-86.73049,geocodio,"3927 Nolensville Pk, Nashville, TN 37211","3927 Nolensville Pike, Nashville, TN 37211",0.93
Tennessee Latino Civil Rights Organization,2015,,TN,NASHVILLE,DAVIDSON,Advocacy,36.165688,-86.778098,geocodio,"NASHVILLE, TN","Nashville, TN 37201",1
Hispanic Directors Association of New Jersey,1991,"90A Jersey Ave, New Brunswick, NJ 08901",NJ,NEW BRUNSWICK,CAMDEN,Advocacy,40.488206,-74.457279,geocodio,"90A Jersey Ave, New Brunswick, NJ 08901","90 Jersey Ave, New Brunswick, NJ 08901",0.99
Latino Leadership Alliance Foundation,2004,"402 LIVINGSTON AVE, NEW BRUNSWICK, NJ 08901",NJ,NEW BRUNSWICK,MIDDLESEX,CSO,40.479477,-74.458131,geocodio,"402 LIVINGSTON AVE, NEW BRUNSWICK, NJ 08901","402 Livingston Ave, New Brunswick, NJ 08901",1
Progreso Latino Fund,2003,"70 Audubon Street, New Haven, CT 06510",CT,NEW HAVEN,NEW HAVEN,CSO,41.311643,-72.921518,geocodio,"70 Audubon Street, New Haven, CT 06510","70 Audubon St, New Haven, CT 06510",1
Unidad Latina Accion,2002,"37 Howe St, New Haven, CT 06511",CT,NEW HAVEN,NEW HAVEN,Advocacy,41.308028,-72.936051,geocodio,"37 Howe St, New Haven, CT 06511","37 Howe St, New Haven, CT 06511",1
Hispanic Alliance of Southeastern Connecticut,2000,,CT,NEW LONDON,NEW LONDON,CSO,41.35565,-72.09952,geocodio,"NEW LONDON, CT","New London, CT 06320",1
Latino Farmers Cooperative Of Louisiana,2010,428 S Jefferson Davis Pkwy New Orleans LA 70119-7126,LA,NEW ORLEANS,ORLEANS PARISH,CSO,29.967441,-90.096964,geocodio,428 S Jefferson Davis Pkwy New Orleans LA 70119-7126,"428 S Jefferson Davis Pkwy, New Orleans, LA 70119",1
SEED Hispanic Latino Center for Educational Development,2012,,LA,NEW ORLEANS,ORLEANS PARISH,CSO,29.958304,-90.077,geocodio,"NEW ORLEANS, LA","New Orleans, LA 70112",1
Foundation for Healthy Hispanic Families,2015,,NY,NEW ROCHELLE,WESTCHESTER,CSO,40.91757,-73.784858,geocodio,"NEW ROCHELLE, NY","New Rochelle, NY 10801",1
Asociacion Tepeyac de New York,1997,"38 W 38th St, New York, NY 10018",NY,NEW YORK,NEW YORK,CSO,40.751618,-73.984514,geocodio,"38 W 38th St, New York, NY 10018","38 W 38th St, New York, NY 10018",1
Coalition for Hispanic Family Services,1990,"315 Wyckoff Ave #4, Brooklyn, NY 11237",NY,NEW YORK,NEW YORK,CSO,40.700101,-73.911839,geocodio,"315 Wyckoff Ave #4, Brooklyn, NY 11237","315 Wyckoff Ave, Ste 4, Brooklyn, NY 11237",1
Committee for Hispanic Children and Families,1982,"75 Broad Street Ste 620 New York, NY 10004",NY,NEW YORK,NEW YORK,Hybrid,40.704641,-74.011427,geocodio,"75 Broad Street Ste 620 New York, NY 10004","75 Broad St, Rm 620, New York, NY 10004",1
Hispanic AIDS Forum,1985,"1767 Park Avenue, 5th Floor, New York, NY 10035",NY,NEW YORK,NEW YORK,CSO,40.803278,-73.940038,geocodio,"1767 Park Avenue, 5th Floor, New York, NY 10035","1767 Park Ave, Fl 5, New York, NY 10035",1
Hispanic Brotherhood Housing Corporation,1984,"59 Clinton Avenue, Rockville Centre, New York 11570",NY,NEW YORK,NEW YORK,CSO,40.660717,-73.645698,geocodio,"59 Clinton Avenue, Rockville Centre, New York 11570","59 Clinton Ave, Rockville Centre, NY 11570",1
Hispanic Community Organization for Life,2009,"62 WEST 107TH STREET NEW YORK, NY 10025",NY,NEW YORK,NEW YORK,CSO,40.799412,-73.961424,geocodio,"62 WEST 107TH STREET NEW YORK, NY 10025","62 W 107th St, New York, NY 10025",1
Hispanic Federation,1990,"55 Exchange Place, 5th Floor, New York, NY, 10005-3301",NY,NEW YORK,NEW YORK,Hybrid,40.706847,-74.012946,geocodio,"55 Exchange Place, 5th Floor, New York, NY, 10005-3301","55 Exchange Plz, Fl 5, New York, NY 10006",1
Hispanic Information and Telecommunications Network,1982,"63 Flushing Avenue, Building #292, Suite #211, Brooklyn, NY 11205-1005",NY,NEW YORK,NEW YORK,CSO,40.698236,-73.975164,geocodio,"63 Flushing Avenue, Building #292, Suite #211, Brooklyn, NY 11205-1005","63 Flushing Ave, Unit 211, Brooklyn, NY 11205",1
Hispanic Policy Development Project,1982,"New York, NY 10010",NY,NEW YORK,NEW YORK,Advocacy,40.739024,-73.983542,geocodio,"New York, NY 10010","New York, NY 10010",1
La Unidad Latina Foundation,1999,,NY,NEW YORK,NEW YORK,CSO,40.750422,-73.996328,geocodio,"NEW YORK, NY","New York, NY 10001",1
Latino Center on Aging (LCA),1991,"1133 Broadway, Ste. 708 New York, NY 10010 ",NY,NEW YORK,NEW YORK,Hybrid,40.743589,-73.989196,geocodio,"1133 Broadway, Ste. 708 New York, NY 10010","1133 Broadway, Ste 708, New York, NY 10010",1
Latino Commission on AIDS,1990,"24 W 25th St, New York, NY 10010",NY,NEW YORK,NEW YORK,Hybrid,40.743414,-73.990276,geocodio,"24 W 25th St, New York, NY 10010","24 W 25th St, New York, NY 10010",1
Latino Justice PRLDEF,1972,"99 Hudson St #14, New York, NY 10013",NY,NEW YORK,NEW YORK,Advocacy,40.718983,-74.008936,geocodio,"99 Hudson St #14, New York, NY 10013","99 Hudson St, Fl 14, New York, NY 10013",1
Latino Leadership Institute,2000,,NY,NEW YORK,NEW YORK,Advocacy,40.750422,-73.996328,geocodio,"NEW YORK, NY","New York, NY 10001",1
Latino Organization for Liver Awareness,1994,"Throggs Neck Sta. Bronx, NY 10465",NY,NEW YORK,NEW YORK,CSO,40.817567,-73.806722,geocodio,"Throggs Neck Sta. Bronx, NY 10465","Throggs Neck Expy, Bronx, NY 10465",1
Leadership Enterprise for a Diverse America,2003,"501 Seventh Avenue 7th Floor New York, NY 10018-5970",NY,NEW YORK,NEW YORK,CSO,40.753025,-73.988928,geocodio,"501 Seventh Avenue 7th Floor New York, NY 10018-5970","501 7th Ave, Fl 7, New York, NY 10018",1
Mexican Coalition for The Empowerment of Youth And Families,2003,"10 East 39th Street, Office 1119, New York, NY 10016",NY,NEW YORK,NEW YORK,CSO,40.751164,-73.981527,geocodio,"10 East 39th Street, Office 1119, New York, NY 10016","10 E 39th St, New York, NY 10016",1
National Institute for Latino Policy,1982,"25 W 18th St, New York, NY 10011",NY,NEW YORK,NEW YORK,Advocacy,40.739237,-73.993265,geocodio,"25 W 18th St, New York, NY 10011","25 W 18th St, New York, NY 10011",1
National Latina Institute for Reproductive Health,1994,"50 Broad St., Ste. 1937 New York, NY 10004 ",NY,NEW YORK,NEW YORK,Hybrid,40.705827,-74.011563,geocodio,"50 Broad St., Ste. 1937 New York, NY 10004","50 Broad St, Ste 1937, New York, NY 10004",1
National Latino Alliance for the Elimination of Domestic Violence,1997,"New York, NY 10035-0672",NY,NEW YORK,NEW YORK,CSO,40.801913,-73.9347,geocodio,"New York, NY 10035-0672","New York, NY 10035",1
National Latino Council on Alcohol and Tobacco Prevention,1989,"101 Avenue of the Americas, Suite 313, New York,NY, 10013",NY,NEW YORK,NEW YORK,CSO,40.723418,-74.005243,geocodio,"101 Avenue of the Americas, Suite 313, New York,NY, 10013","101 Ave Of The Americas, Ste 313, New York, NY 10013",1
National Latino Officers Association,1996,"27-14 Kearney St, East Elmhurst NY 11369-1954",NY,NEW YORK,NEW YORK,Advocacy,40.762176,-73.868701,geocodio,"27-14 Kearney St, East Elmhurst NY 11369-1954","27-18 Kearney St, East Elmhurst, NY 11369",0.85
FOCUS Hispanic Center for Community Development,1967,"441 Broad St, Newark, NJ 07102",NJ,NEWARK,ESSEX,CSO,40.746439,-74.170675,geocodio,"441 Broad St, Newark, NJ 07102","441 Broad St, Newark, NJ 07102",1
La Casa De Don Pedro,1972,,NJ,NEWARK,ESSEX,CSO,40.735642,-74.173988,geocodio,"NEWARK, NJ","Newark, NJ 07102",1
Latino Institute,2004,"50 Park Pl #1539, Newark, NJ 07102",NJ,NEWARK,ESSEX,CSO,40.739132,-74.168481,geocodio,"50 Park Pl #1539, Newark, NJ 07102","50 Park Pl, Ste 1539, Newark, NJ 07102",1
Hispanic Education Endowment Fund of Orange County Community Foundation,1993,"4041 MacArthur Boulevard, Suite 510, Newport Beach, CA 92660",CA,NEWPORT BEACH,ORANGE,CSO,33.661573,-117.863639,geocodio,"4041 MacArthur Boulevard, Suite 510, Newport Beach, CA 92660","4041 Macarthur Blvd, Ste 510, Newport Beach, CA 92660",1
Southern Latino Foundation,2001,,GA,NORCROSS,GWINNETT,CSO,33.944461,-84.210969,geocodio,"NORCROSS, GA","Norcross, GA 30071",1
Latino Alzheimers and Memory Disorders Alliance,2008,,IL,NORRIDGE,COOK,CSO,41.97428,-87.827131,geocodio,"NORRIDGE, IL","Norridge, IL 60656",1
Accion Comunal Latino Americano de Montgomery County,1977,"512 West Marshall Street,Norristown, PA 19401",PA,NORRISTOWN,MONTGOMERY,CSO,40.120253,-75.34951,geocodio,"512 West Marshall Street,Norristown, PA 19401","512 W Marshall St, Norristown, PA 19401",1
For Chicana Chicanos Studies Foundation,1996,,CA,NORTHRIDGE,LOS ANGELES,Advocacy,34.238208,-118.55029,geocodio,"NORTHRIDGE, CA","Northridge, CA 91324",1
lthe Latino Family Institute,1996,"6551 North Ave Oak Park, IL 60302-1020 ",IL,OAK PARK,COOK,CSO,41.908942,-87.78977,geocodio,"6551 North Ave Oak Park, IL 60302-1020","6551 North Ave, Oak Park, IL 60302",1
Centro Legal de la Raza,1969,"3400 E 12th St, Oakland, CA 94601",CA,OAKLAND,ALAMEDA,Hybrid,37.775383,-122.223941,geocodio,"3400 E 12th St, Oakland, CA 94601","3400 E 12th St, Oakland, CA 94601",1
Hispanics in Philanthropy,1983,"414 13th Street, Suite 200, Oakland, CA 94612",CA,OAKLAND,ALAMEDA,Hybrid,37.803546,-122.270671,geocodio,"414 13th Street, Suite 200, Oakland, CA 94612","414 13th St, Ste 200, Oakland, CA 94612",1
La Clinica de la Raza,1971,"Oakland, CA 94623-2210",CA,OAKLAND,ALAMEDA,CSO,37.680181,-121.921498,geocodio,"Oakland, CA 94623-2210","Oakland, CA 94623",1
National Latina Health Organization,1986,Oakland CA 94601,CA,OAKLAND,ALAMEDA,CSO,37.786027,-122.223779,geocodio,Oakland CA 94601,"Oakland, CA 94601",1
The Unity Council,1964,"1900 Fruitvale Avenue. Suite 2A. Oakland, CA 94601",CA,OAKLAND,ALAMEDA,Hybrid,37.78295,-122.22263,geocodio,"1900 Fruitvale Avenue. Suite 2A. Oakland, CA 94601","1900 Fruitvale Ave, Ste 2A, Oakland, CA 94601",1
Latino Community Development Agency,1991,"420 SW 10th St, Oklahoma City, OK 73109",OK,OKLAHOMA CITY,OKLAHOMA CITY,CSO,35.4542,-97.519926,geocodio,"420 SW 10th St, Oklahoma City, OK 73109","420 SW 10th St, Oklahoma City, OK 73109",1
Hispanic Roundtable,2002,"Olympia, WA 98507",WA,OLYMPIA,THURSTON,CSO,46.978118,-122.702393,geocodio,"Olympia, WA 98507","Olympia, WA 98507",1
Chicano awareness center,1972,"4821 S 24th Street Omaha, NE 68107 ",NE,OMAHA,DOUGLAS,CSO,41.210356,-95.946901,geocodio,"4821 S 24th Street Omaha, NE 68107","4821 S 24th St, Omaha, NE 68107",1
Latino Center of the Midlands,1971,"4821 S 24th St, Omaha, NE 68107",NE,OMAHA,DOUGLAS,CSO,41.210356,-95.946901,geocodio,"4821 S 24th St, Omaha, NE 68107","4821 S 24th St, Omaha, NE 68107",1
Latino Community Betterment Corporation,2016,,NE,OMAHA,DOUGLAS,CSO,41.262003,-95.933564,geocodio,"OMAHA, NE","Omaha, NE 68102",1
Midlands Latino Community Development Corporation,2006,"4923 South 24th Street, Ste 201, Omaha NE 68107-2763",NE,OMAHA,DOUGLAS,CSO,41.20896,-95.946904,geocodio,"4923 South 24th Street, Ste 201, Omaha NE 68107-2763","4923 S 24th St, Ste 201, Omaha, NE 68107",1
Latino Leadership,1999,"8617 E Colonial Dr Ste 1200 Orlando, FL 32817-3919",FL,ORLANDO,ORANGE,Hybrid,28.569126,-81.270173,geocodio,"8617 E Colonial Dr Ste 1200 Orlando, FL 32817-3919","8617 E Colonial Dr, Ste 1200, Orlando, FL 32817",1
California Hispanic Osteoporosis Foundation,2005,"300 South A Street, Suite 201, Oxnard, CA 93030",CA,OXNARD,ALAMEDA,Hybrid,34.200075,-119.178196,geocodio,"300 South A Street, Suite 201, Oxnard, CA 93030","300 S A St, Ste 201, Oxnard, CA 93030",1
Brevard Hispanic Center,2014,,FL,PALM BAY,BREVARD,CSO,28.031367,-80.600412,geocodio,"PALM BAY, FL","Palm Bay, FL 32905",1
California Latino Leadership Institute,2014,,CA,PASADENA,LOS ANGELES,CSO,33.786594,-118.298662,geocodio,"PASADENA, CA","Pasadena, CA 91050",1
California Latino Legislative Caucus Institute for Public Policy,2002,,CA,PASADENA,LOS ANGELES,Hybrid,33.786594,-118.298662,geocodio,"PASADENA, CA","Pasadena, CA 91050",1
Latino Institute for Corporate Inclusion,2008,,CA,PASADENA,LOS ANGELES,Advocacy,33.786594,-118.298662,geocodio,"PASADENA, CA","Pasadena, CA 91050",1
Los Angeles County Chicano Employees Association,1969,"1848 Allen Ave, Pasadena, CA 91104",CA,PASADENA,LOS ANGELES,CSO,34.177822,-118.111991,geocodio,"1848 Allen Ave, Pasadena, CA 91104","1848 N Allen Ave, Pasadena, CA 91104",1
National Association for Hispanic Elderly,1975,"234 E Colorado Blvd., Ste. 300 Pasadena CA 91101",CA,PASADENA,LOS ANGELES,CSO,34.145481,-118.145719,geocodio,"234 E Colorado Blvd., Ste. 300 Pasadena CA 91101","234 E Colorado Blvd, Ste 300, Pasadena, CA 91101",1
National Hispanic Media Coalition,1986,55 S Grand Ave Pasadena CA 91105-1602,CA,PASADENA,LOS ANGELES,Advocacy,34.144714,-118.162237,geocodio,55 S Grand Ave Pasadena CA 91105-1602,"55 S Grand Ave, Pasadena, CA 91105",1
Hispanic Academic Achievers Program,1990,,WA,PASCO,FRANKLIN,CSO,46.42066,-118.899447,geocodio,"PASCO, WA","Pasco, WA 99301",1
Hispanic Multi-Purpose Service Center,1976,"911 East 23rd Street Paterson, NJ 07513-1500",NJ,PATERSON,PASSAIC,CSO,40.909008,-74.153167,geocodio,"911 East 23rd Street Paterson, NJ 07513-1500","911 E 23rd St, Paterson, NJ 07513",1
Intergrupo Latino de Grupos de Familia AL Anon Alateen de New Jersey,2014,,NJ,PATERSON,PASSAIC,CSO,40.911999,-74.170965,geocodio,"PATERSON, NJ","Paterson, NJ 07501",1
Hispanic Counseling And Family Services of New Jersey,2000,"3908 Westfield Ave, Pennsauken Township, NJ 08110",NJ,PENNSAUKEN TOWNSHIP,CAMDEN,CSO,39.953913,-75.072629,geocodio,"3908 Westfield Ave, Pennsauken Township, NJ 08110","3908 Westfield Ave, Pennsauken, NJ 08110",1
Mexican Association of Perth Amboy,2004,"131 Patterson St, Perth Amboy, NJ 08861",NJ,PERTH AMBOY,MIDDLESEX,CSO,40.503689,-74.270891,geocodio,"131 Patterson St, Perth Amboy, NJ 08861","131 Patterson St, Perth Amboy, NJ 08861",1
Latino Scholarship Fund,1992,"2603 N 5th St FL 4, Philadelphia, PA 19133",PA,PHILADELPHIA,PHILADELPHIA,CSO,39.990732,-75.140225,geocodio,"2603 N 5th St FL 4, Philadelphia, PA 19133","2603-9 N 5th St, Fl 4, Philadelphia, PA 19133",1
Arizona Latino Media Association,1997,,AZ,PHOENIX,MARICOPA,Advocacy,33.703967,-112.351835,geocodio,"PHOENIX, AZ","Phoenix, AZ 85001",1
Chicanos Por La Causa,1969," 1112 E. BUCKEYE RD. PHOENIX, AZ 85034",AZ,PHOENIX,MARICOPA,CSO,33.43704,-112.058341,geocodio,"1112 E. BUCKEYE RD. PHOENIX, AZ 85034","1112 E Buckeye Rd, Phoenix, AZ 85034",1
Concilio Latino de Salud,1989,"Phoenix, AZ 85068-9837",AZ,PHOENIX,MARICOPA,CSO,33.276539,-112.18717,geocodio,"Phoenix, AZ 85068-9837","Phoenix, AZ 85068",1
Raza Development Fund,1964,"1 E Washington St #2250, Phoenix, AZ 85004",AZ,PHOENIX,MARICOPA,CSO,33.447919,-112.073568,geocodio,"1 E Washington St #2250, Phoenix, AZ 85004","1 E Washington St, Ste 2250, Phoenix, AZ 85004",1
Claret Hispanic Organization,2015,,CA,PICO RIVERA,LOS ANGELES,CSO,33.985812,-118.088787,geocodio,"PICO RIVERA, CA","Pico Rivera, CA 90660",1
Plaza De La Raza Child Development Services,1965,"8337 Telegraph Rd Fl 3 Pico Rivera, CA 90660-495",CA,PICO RIVERA,LOS ANGELES,CSO,33.964824,-118.112975,geocodio,"8337 Telegraph Rd Fl 3 Pico Rivera, CA 90660-495","8337 Telegraph Rd, Fl 3, Pico Rivera, CA 90660",1
Hispanic Committee of The South,2009,"5438 Shreveport Hwy, Pineville, LA 71360",LA,PINEVILLE,RAPIDES PARISH,CSO,31.397133,-92.440836,geocodio,"5438 Shreveport Hwy, Pineville, LA 71360","5438 Shreveport Hwy, Pineville, LA 71360",1
Hispanic Liaison of Chatham County,1995,"97 Box Turtle Rd Pittsboro, NC 27312-5358",NC,PITTSBORO,CHATHAM,CSO,35.792118,-79.303533,geocodio,"97 Box Turtle Rd Pittsboro, NC 27312-5358","97 Box Turtle Rd, Pittsboro, NC 27312",1
Pittsburgh Hispanic Development Corporation,2013,"1660 Broadway Avenue,Pittsburgh, Pennsylvania",PA,PITTSBURGH,ALLEGHENY,CSO,40.408842,-80.024965,geocodio,"1660 Broadway Avenue,Pittsburgh, Pennsylvania","1660 Broadway Ave, Pittsburgh, PA 15216",1
Asociacion Latina Dios Bendice Siempre,2015,,NJ,PLEASANTVILLE,ATLANTIC,CSO,39.387525,-74.515196,geocodio,"PLEASANTVILLE, NJ","Pleasantville, NJ 08232",1
Latino Educational Fund,2010,,CA,POMONA,LOS ANGELES,CSO,34.042286,-117.756106,geocodio,"POMONA, CA","Pomona, CA 91766",1
Hispanic Council of St Clair County,1990,,MI,PORT HURON,ST. CLAIR,CSO,42.984014,-82.467461,geocodio,"PORT HURON, MI","Port Huron, MI 48060",1
Latino Network,1996,"410 NE 18th Ave Portland, OR 97232-2882 USA",OR,PORTLAND,MULTNOMAH,CSO,45.525792,-122.647391,geocodio,"410 NE 18th Ave Portland, OR 97232-2882 USA","410 NE 18th Ave, Portland, OR 97232",1
Oregon Council for Hispanic Advancement,1984,"108 NW 9th street Suite 201, Portland, OR 97209",OR,PORTLAND,MULTNOMAH,CSO,45.523871,-122.679823,geocodio,"108 NW 9th street Suite 201, Portland, OR 97209","108 NW 9th Ave, Ste 201, Portland, OR 97209",1
Oregon Latino Health Coalition,2004,,OR,PORTLAND,MULTNOMAH,Hybrid,45.507856,-122.690794,geocodio,"PORTLAND, OR","Portland, OR 97201",1
Portland Latino Gay Pride,2006,,OR,PORTLAND,MULTNOMAH,CSO,45.507856,-122.690794,geocodio,"PORTLAND, OR","Portland, OR 97201",1
Center for Hispanic Policy and Advocacy,1986,"421 Elmwood Avenue, Providence, RI 2907",RI,PROVIDENCE,PROVIDENCE,CSO,41.800633,-71.426842,geocodio,"421 Elmwood Avenue, Providence, RI 2907","421 Elmwood Ave, Providence, RI 02907",1
Rhode Island Latina Leadership Institute,2003,,RI,PROVIDENCE,PROVIDENCE,Hybrid,41.81835,-71.424851,geocodio,"PROVIDENCE, RI","Providence, RI 02902",1
RI Latino Dollars for Scholars,1993,,RI,PROVIDENCE,PROVIDENCE,CSO,41.81835,-71.424851,geocodio,"PROVIDENCE, RI","Providence, RI 02902",1
Pueblo Latino Hispanic Education Foundation,1988,"2200 Bonforte Blvd Admin. #329 Pueblo, CO 81001",CO,PUEBLO,PUEBLO,CSO,38.308547,-104.577068,geocodio,"2200 Bonforte Blvd Admin. #329 Pueblo, CO 81001","2200 Bonforte Blvd, # 329, Pueblo, CO 81001",1
Centro Hispano,1988,"Reading, PA 19603",PA,READING,BERKS,CSO,40.388442,-75.963055,geocodio,"Reading, PA 19603","Reading, PA 19603",1
Latino Outreach of Tehama County,1995,,CA,RED BLUFF,TEHAMA,CSO,40.142907,-122.340888,geocodio,"RED BLUFF, CA","Red Bluff, CA 96080",1
Hispanic Outreach Program of Goodhue County,2009,"1407 W 4th Street, Red Wing, MN 55066",MN,RED WING,GOODHUE,CSO,44.560475,-92.547514,geocodio,"1407 W 4th Street, Red Wing, MN 55066","1407 W 4th St, Red Wing, MN 55066",1
Latino Influentials Network,2014,,NC,REIDSVILLE,ROCKINGHAM,CSO,36.358275,-79.742001,geocodio,"REIDSVILLE, NC","Reidsville, NC 27320",1
Nevada Hispanic Services,1975,"3905 NEIL ROAD, SUITE #2, RENO, NV, 89502",NV,RENO,WASHOE,CSO,39.488701,-119.780988,geocodio,"3905 NEIL ROAD, SUITE #2, RENO, NV, 89502","3905 Neil Rd, Ste 2, Reno, NV 89502",1
Tu Casa Latina,2015,,NV,RENO,WASHOE,CSO,39.525749,-119.813051,geocodio,"RENO, NV","Reno, NV 89501",1
Hispanic American Freethinkers,2010,"1818 Library St, Reston, VA 20190",VA,RESTON,FAIRFAX,CSO,38.958398,-77.358829,geocodio,"1818 Library St, Reston, VA 20190","1818 Library St, Reston, VA 20190",1
"AMIGOS, the Richmond Latino Center",1999,"1215 S J St. Richmond, IN 47374",IN,RICHMOND,WAYNE,CSO,39.815177,-84.885679,geocodio,"1215 S J St. Richmond, IN 47374","1215 S J St, Richmond, IN 47374",1
Latina Center,2001,,CA,RICHMOND,CONTRA COSTA,CSO,37.947523,-122.384032,geocodio,"RICHMOND, CA","Richmond, CA 94801",1
Hispanic American Institute,1999,,NM,RIO RANCHO,SANDOVAL,CSO,35.268498,-106.783682,geocodio,"RIO RANCHO, NM","Rio Rancho, NM 87124",1
Inland Empire Latino Lawyers Association Inc,1978,"2060 University Ave, Suite 113, Riverside, CA",CA,RIVERSIDE,RIVERSIDE,CSO,33.975063,-117.356334,geocodio,"2060 University Ave, Suite 113, Riverside, CA","2060 University Ave, Ste 113, Riverside, CA 92507",1
Latino Mentor Program,2000,,CA,RIVERSIDE,RIVERSIDE,CSO,33.99504,-117.373184,geocodio,"RIVERSIDE, CA","Riverside, CA 92501",1
La Voz Latina,1971,,IL,ROCKFORD,WINNEBAGO,CSO,42.33342,-89.157198,geocodio,"ROCKFORD, IL","Rockford, IL 61101",1
Hispanic Brotherhood of Rockville Centre,1984,,NY,ROCKVILLE CENTRE,NASSAU,CSO,40.667352,-73.638523,geocodio,"ROCKVILLE CENTRE, NY","Rockville Centre, NY 11570",1
Apoyo Latino,1987,,AR,ROGERS,BENTON,CSO,36.320391,-93.978383,geocodio,"ROGERS, AR","Rogers, AR 72756",1
Healthy Latino Community,2006,,NY,ROSLYN HEIGHTS,NASSAU,CSO,40.77877,-73.63963,geocodio,"ROSLYN HEIGHTS, NY","Roslyn Heights, NY 11577",1
Sociedad Latina,1968,,MA,ROXBURY,SUFFOLK,CSO,42.325098,-71.095329,geocodio,"ROXBURY, MA","Roxbury, MA 02119",1
California Hispanic Commission on Alcohol And Drug Abuse,1975,"2101 Capitol Avenue, Sacramento, CA 95816",CA,SACRAMENTO,SACRAMENTO,CSO,38.573196,-121.479414,geocodio,"2101 Capitol Avenue, Sacramento, CA 95816","2101 Capitol Ave, Sacramento, CA 95816",1
California Latino Water Coalition,2007,"1415 L Street Sacramento, CA 95814-3961",CA,SACRAMENTO,SACRAMENTO,Advocacy,38.576832,-121.488303,geocodio,"1415 L Street Sacramento, CA 95814-3961","1415 L St, Sacramento, CA 95814",1
