Name,F.year,Address,States,City,County,Type,latitude,longitude,geocode_source,geocode_input,matched_address,match_type
Chicano and Latino Youth Leadership Project,1982,"Sacramento, CA 95816-1566",CA,SACRAMENTO,SACRAMENTO,CSO,38.571505,-121.467549,geocodio,"Sacramento, CA 95816-1566","Sacramento, CA 95816",1
Latino Coalition for a Healthy California,1992,"1225 8th St., Ste. 550 Sacramento, CA 95814",CA,SACRAMENTO,SACRAMENTO,Hybrid,38.578515,-121.49706,geocodio,"1225 8th St., Ste. 550 Sacramento, CA 95814","1225 8th St, Ste 550, Sacramento, CA 95814",1
Latino Leadership and Policy Forum,2014,1022 G St Sacramento CA 95814-0823,CA,SACRAMENTO,SACRAMENTO,Advocacy,38.583183,-121.491269,geocodio,1022 G St Sacramento CA 95814-0823,"1022 G St, Sacramento, CA 95814",1
Latino Policy Coalition,2007,"1830 N ST SACRAMENTO , CA 95811 ",CA,SACRAMENTO,SACRAMENTO,Advocacy,38.572459,-121.483455,geocodio,"1830 N ST SACRAMENTO , CA 95811","1830 N St, Sacramento, CA 95811",1
Mexican American Alcoholism Program,1975,"4241 Florin Road, Suite 110 Sacramento, CA 95823",CA,SACRAMENTO,SACRAMENTO,CSO,38.496819,-121.458262,geocodio,"4241 Florin Road, Suite 110 Sacramento, CA 95823","4241 Florin Rd, Ste 110, Sacramento, CA 95823",1
National Coalition of Hispanic Organizations,1975,"Sacramento, CA 95812",CA,SACRAMENTO,SACRAMENTO,Advocacy,38.377411,-121.444429,geocodio,"Sacramento, CA 95812","Sacramento, CA 95812",1
National Community College Hispanic Council,1985,1 Capitol Mall Ste 800 Sacramento CA 95814-3274,CA,SACRAMENTO,SACRAMENTO,Advocacy,38.580411,-121.505898,geocodio,1 Capitol Mall Ste 800 Sacramento CA 95814-3274,"1 Capitol Mall, Ste 800, Sacramento, CA 95814",1
Union Latina St Charles,2006,,IL,SAINT CHARLES,DUPAGE,CSO,41.930757,-88.298737,geocodio,"SAINT CHARLES, IL","Saint Charles, IL 60174",1
Comunidades Latinas Unidas En Servicio,1981,"Saint Paul, MN 55106-5014",MN,SAINT PAUL,RAMSEY,Hybrid,44.957065,-93.041616,geocodio,"Saint Paul, MN 55106-5014","Saint Paul, MN 55106",1
Hispanic Advocacy and Community Empowerment through Research,1988,"2314 University Ave W Ste 12 Saint Paul, MN 55114-1863",MN,SAINT PAUL,RAMSEY,Advocacy,44.962752,-93.19532,geocodio,"2314 University Ave W Ste 12 Saint Paul, MN 55114-1863","2314 University Ave W, Ste 12, Saint Paul, MN 55114",1
Latino Educational and Recreational Network,1986,"Salem, Or 97303",OR,SALEM,MARION,CSO,44.992731,-123.01672,geocodio,"Salem, Or 97303","Salem, OR 97303",1
Hispanic Health Care Task Force,2014,,UT,SALT LAKE CITY,SALT LAKE,CSO,40.756095,-111.900719,geocodio,"SALT LAKE CITY, UT","Salt Lake City, UT 84101",1
Utah Coalition of LA Raza,1992,,UT,SALT LAKE CITY,SALT LAKE,Advocacy,40.756095,-111.900719,geocodio,"SALT LAKE CITY, UT","Salt Lake City, UT 84101",1
Hispanic Association of Colleges And Universities,1986,"8415 Datapoint Dr., Ste. 400 San Antonio, TX 78229",TX,SAN ANTONIO,BEXAR,Hybrid,29.518699,-98.569529,geocodio,"8415 Datapoint Dr., Ste. 400 San Antonio, TX 78229","8415 Datapoint Dr, Ste 400, San Antonio, TX 78229",1
Hispanic Healthy Processes,2011,,TX,SAN ANTONIO,BEXAR,CSO,29.468413,-98.528889,geocodio,"SAN ANTONIO, TX","San Antonio, TX 78201",1
Hispanic Leadership Development Foundation,2000,,TX,SAN ANTONIO,BEXAR,Hybrid,29.468413,-98.528889,geocodio,"SAN ANTONIO, TX","San Antonio, TX 78201",1
Hispanic Religious Partnership for Community Health,1997,"5415 Bandera Rd Ste 504 San Antonio, TX 78238-1958",TX,SAN ANTONIO,BEXAR,CSO,29.481327,-98.592826,geocodio,"5415 Bandera Rd Ste 504 San Antonio, TX 78238-1958","5415 Bandera Rd, Ste 504, San Antonio, TX 78238",1
Hispanic Sports Foundation For Education,2006,"166 W Ligustrum Dr San Antonio, TX 78228-4048",TX,SAN ANTONIO,BEXAR,CSO,29.46246,-98.564993,geocodio,"166 W Ligustrum Dr San Antonio, TX 78228-4048","166 W Ligustrum Dr, San Antonio, TX 78228",1
Latino Educational Equity Partnerships,2015,,TX,SAN ANTONIO,BEXAR,CSO,29.468413,-98.528889,geocodio,"SAN ANTONIO, TX","San Antonio, TX 78201",1
National Association for Latino Community Asset Builders,2002,"San Antonio, TX 78246-1266",TX,SAN ANTONIO,BEXAR,CSO,29.437532,-98.461582,geocodio,"San Antonio, TX 78246-1266","San Antonio, TX 78246",1
National Latino Childrens Institute,1997,"118 Broadway St Ste 615, San Antonio, TX 78205-2007",TX,SAN ANTONIO,BEXAR,Advocacy,29.427315,-98.487524,geocodio,"118 Broadway St Ste 615, San Antonio, TX 78205-2007","118 Broadway St, Ste 615, San Antonio, TX 78205",1
National Organization for Mexican American Rights,1998,"San Antonio, Texas",TX,SAN ANTONIO,BEXAR,Advocacy,29.468413,-98.528889,geocodio,"San Antonio, Texas","San Antonio, TX 78201",1
Chicano Federation of San Diego County,1969,"3180 University Ave., Ste. 317, San Diego, CA 92104",CA,SAN DIEGO,SAN DIEGO,Hybrid,32.748772,-117.125573,geocodio,"3180 University Ave., Ste. 317, San Diego, CA 92104","3180 University Ave, Ste 317, San Diego, CA 92104",1
Latino Policy Institute of San Diego,2004,,CA,SAN DIEGO,SAN DIEGO,CSO,32.724103,-117.170912,geocodio,"SAN DIEGO, CA","San Diego, CA 92101",1
Pacto Latino AIDS Organization,1994,"2828 University Ave #107, San Diego, CA 92104",CA,SAN DIEGO,SAN DIEGO,CSO,32.748643,-117.132991,geocodio,"2828 University Ave #107, San Diego, CA 92104","2828 University Ave, Ste 107, San Diego, CA 92104",1
Raza Education Fund,2009,,CA,SAN DIEGO,SAN DIEGO,CSO,32.724103,-117.170912,geocodio,"SAN DIEGO, CA","San Diego, CA 92101",1
Accion Latina,1970,,CA,SAN FRANCISCO,SAN FRANCISCO,Advocacy,37.776646,-122.417481,geocodio,"SAN FRANCISCO, CA","San Francisco, CA 94101",1
Centro Latino de San Francisco,1972,"1656 15th St., San Fransisco, CA 94103",CA,SAN FRANCISCO,SAN FRANCISCO,CSO,37.766806,-122.421267,geocodio,"1656 15th St., San Fransisco, CA 94103","1656 15th St, San Francisco, CA 94103",1
Instituto Familiar de la Raza,1978,"2919 Mission Street, San Francisco, CA 94110",CA,SAN FRANCISCO,SAN FRANCISCO,CSO,37.750304,-122.417913,geocodio,"2919 Mission Street, San Francisco, CA 94110","2919 Mission St, San Francisco, CA 94110",1
Instituto Laboral de la Raza,1982,"2947 16th St., San Francisco, CA 94103",CA,SAN FRANCISCO,SAN FRANCISCO,Advocacy,37.764895,-122.418485,geocodio,"2947 16th St., San Francisco, CA 94103","2947 16th St, San Francisco, CA 94103",1
La Raza Centro Legal San Francisco,1973,,CA,SAN FRANCISCO,SAN FRANCISCO,Hybrid,37.776646,-122.417481,geocodio,"SAN FRANCISCO, CA","San Francisco, CA 94101",1
La Raza Community Resource Center,1974,,CA,SAN FRANCISCO,SAN FRANCISCO,CSO,37.776646,-122.417481,geocodio,"SAN FRANCISCO, CA","San Francisco, CA 94101",1
Latina Breast Cancer Agency,2002,"4271 Mission Street, 2nd FL, San Francisco, CA 94112",CA,SAN FRANCISCO,SAN FRANCISCO,CSO,37.728965,-122.430819,geocodio,"4271 Mission Street, 2nd FL, San Francisco, CA 94112","4271 Mission St, Fl 2, San Francisco, CA 94112",1
Latino Commission on Alcohol and Drug Abuse Services of San Mateo County,1997,"301 Grand Ave #301, South San Francisco, CA 94080",CA,SAN FRANCISCO,SAN FRANCISCO,CSO,37.655002,-122.410376,geocodio,"301 Grand Ave #301, South San Francisco, CA 94080","301 Grand Ave, #, South San Francisco, CA 94080",1
Latino Community Foundation,1989,"225 Bush St Ste 500 San Francisco, CA 94104-4224",CA,SAN FRANCISCO,SAN FRANCISCO,Advocacy,37.790937,-122.401337,geocodio,"225 Bush St Ste 500 San Francisco, CA 94104-4224","225 Bush St, Ste 500, San Francisco, CA 94104",1
California Latino Environmental Advocacy Network Clean,2014,,CA,SAN GABRIEL,LOS ANGELES,Advocacy,34.114772,-118.089431,geocodio,"SAN GABRIEL, CA","San Gabriel, CA 91775",1
Hispanic Foundation of Silicon Valley,1990,"1922 The Alameda, Suite 217 San Jose, CA 95126-1430",CA,SAN JOSE,SANTA CLARA,CSO,37.341474,-121.923365,geocodio,"1922 The Alameda, Suite 217 San Jose, CA 95126-1430","1922 The Alameda, Ste 217, San Jose, CA 95126",1
Latina Coalition of Silicon Valley,1998,"1346 The Alameda, Ste 7-293, San Jos?, CA 95126",CA,SAN JOSE,SANTA CLARA,CSO,37.33287,-121.912826,geocodio,"1346 The Alameda, Ste 7-293, San Jos?, CA 95126","1346 The Alameda, Ste 7-293, San Jose, CA 95126",1
Los Bomberos of Northern California,1972," 425 E Santa Clara St., Ste. 310 San Jose, CA 95113",CA,SAN JOSE,SANTA CLARA,CSO,37.340748,-121.88166,geocodio,"425 E Santa Clara St., Ste. 310 San Jose, CA 95113","425 E Santa Clara St, Ste 310, San Jose, CA 95113",1
Mexican American Community Services Agency,1964,"660 Sinclair Dr, San Jose, CA 95116",CA,SAN JOSE,SANTA CLARA,CSO,37.349658,-121.841124,geocodio,"660 Sinclair Dr, San Jose, CA 95116","660 Sinclair Dr, San Jose, CA 95116",1
Latino Council of Marin,1977,"734 A St #6, San Rafael, CA 94901",CA,SAN RAFAEL,MARIN,CSO,37.970734,-122.528458,geocodio,"734 A St #6, San Rafael, CA 94901","734 A St, # 6, San Rafael, CA 94901",1
Hispanic Task Force of Lee County,1994,"309 W Main St, Sanford, North Carolina 27332-5921",NC,SANFORD,LEE,CSO,35.455662,-79.154068,geocodio,"309 W Main St, Sanford, North Carolina 27332-5921","309 W Main St, Sanford, NC 27332",1
Latino Center For Prevention and Action In Health and Welfare,1993,"450 W 4th Street Santa Ana, CA 92701-4562",CA,SANTA ANA,ORANGE,Hybrid,33.747743,-117.871834,geocodio,"450 W 4th Street Santa Ana, CA 92701-4562","450 W 4th St, Santa Ana, CA 92701",1
Latino Health Access,1993,"450 W Fourth St., Suite 130, Santa Ana, CA 92701",CA,SANTA ANA,ORANGE,Hybrid,33.747743,-117.871834,geocodio,"450 W Fourth St., Suite 130, Santa Ana, CA 92701","450 W 4th St, Ste 130, Santa Ana, CA 92701",1
La Casa de la Raza,1971,"601 E. MONTECITO STREET SANTA BARBARA, CA 93103",CA,SANTA BARBARA,SANTA BARBARA,CSO,34.421682,-119.686288,geocodio,"601 E. MONTECITO STREET SANTA BARBARA, CA 93103","601 E Montecito St, Santa Barbara, CA 93103",1
Santa Paula Latino Town Hall,1996,,CA,SANTA PAULA,VENTURA,CSO,34.364943,-119.085704,geocodio,"SANTA PAULA, CA","Santa Paula, CA 93060",1
Latino Commission on Alcohol and Drug Abuse Services of Sonoma County,1994,"857 Dutton Ave, Santa Rosa, CA 95407",CA,SANTA ROSA,SONOMA,CSO,38.42745,-122.725275,geocodio,"857 Dutton Ave, Santa Rosa, CA 95407","857 Dutton Ave, Santa Rosa, CA 95407",1
Latino Unidos Del Condado De Sonoma,2012,"Santa Rosa, CA 95402-5410",CA,SANTA ROSA,SONOMA,CSO,38.440061,-122.710598,geocodio,"Santa Rosa, CA 95402-5410","Santa Rosa, CA 95402",1
El Centro de La Raza,1972,,WA,SEATTLE,KING,Advocacy,47.610902,-122.336422,geocodio,"SEATTLE, WA","Seattle, WA 98101",1
El Comite Pro-Reforma Migratoria Y Justicia Social,1999,,WA,SEATTLE,KING,Advocacy,47.610902,-122.336422,geocodio,"SEATTLE, WA","Seattle, WA 98101",1
Latino Community Fund of Washington State,2005,,WA,SEATTLE,KING,CSO,47.610902,-122.336422,geocodio,"SEATTLE, WA","Seattle, WA 98101",1
Latino/a Educational Achievement Project,1998,"113-23rd Ave S. Seattle, WA 98144",WA,SEATTLE,KING,CSO,47.600958,-122.302734,geocodio,"113-23rd Ave S. Seattle, WA 98144","113 23rd Ave S, Seattle, WA 98144",1
Viva Hispanic Foundation NW,2001,,WA,SEATTLE,KING,CSO,47.610902,-122.336422,geocodio,"SEATTLE, WA","Seattle, WA 98101",1
Centro Latino of Shelbyville,2002,"121 Main Street, Shelbyville, KY 40065-1021",KY,SHELBYVILLE,SHELBY,CSO,38.21091,-85.21108,geocodio,"121 Main Street, Shelbyville, KY 40065-1021","121 Main St, Shelbyville, KY 40065",1
Together for Latinas,2009,"Shelton, CT 06484",CT,SHELTON,FAIRFIELD,CSO,41.314347,-73.137143,geocodio,"Shelton, CT 06484","Shelton, CT 06484",1
Centro de Ayuda Latina,2016,,NC,SILER CITY,CHATHAM,CSO,35.72347,-79.46224,geocodio,"SILER CITY, NC","Siler City, NC 27344",1
Maryland Hispanic Coalition,2014,"11719 Galt Ave, Silver Spring, MD 20902",MD,SILVER SPRING,MONTGOMERY,CSO,39.049347,-77.05385,geocodio,"11719 Galt Ave, Silver Spring, MD 20902","11719 Galt Ave, Silver Spring, MD 20902",1
Generacion Latina,2010,,GA,SMYRNA,COBB,CSO,33.09374,-84.57382,geocodio,"SMYRNA, GA","Gay, GA 30218",1
Hispanic Community Connection Conexion Comunidad Hispana,2014,,UT,SOUTH JORDAN,SALT LAKE,CSO,40.554098,-111.953891,geocodio,"SOUTH JORDAN, UT","South Jordan, UT 84095",1
Hispanic Women's Organization of Arkansas,1999,"614 E Emma Ave #231, Springdale, AR 72764",AK,SPRINGDALE,WASHINGTON,Hybrid,36.185396,-94.122907,geocodio,"614 E Emma Ave #231, Springdale, AR 72764","614 E Emma Ave, Ste 231, Springdale, AR 72764",1
National Hispanic Leadership Agenda,1991,"6800 Versar Center Drive No 450 Springfield, VA 22151-0000",VA,SPRINGFIELD,FAIRFAX,Advocacy,38.793699,-77.178825,geocodio,"6800 Versar Center Drive No 450 Springfield, VA 22151-0000","6800 Versar Ctr, Ste 450, Springfield, VA 22151",1
"Hispanic Educational, Cultural and Scholarship Fund",1998,,MO,ST. LOUIS,ST. LOUIS,CSO,38.631501,-90.19231,geocodio,"ST. LOUIS, MO","Saint Louis, MO 63101",1
Chicano Research Center,2015,,CA,STOCKTON,SAN JOAQUIN,CSO,37.672196,-121.298794,geocodio,"STOCKTON, CA","Stockton, CA 95201",1
Centro Latino Ser -Jobs for Progress,1991,"1208 S. 10th St., Tacoma
WA, 98405",WA,TACOMA,PIERCE,CSO,47.252598,-122.453757,geocodio,"1208 S. 10th St., Tacoma
WA, 98405","1208 S 10th St, Tacoma, WA 98405",1
Hispanic Services Council,1991,"2902 N Armenia Ave Ste 201 Tampa, FL 33607-1661",FL,TAMPA,HILLSBOROUGH,CSO,27.966198,-82.485171,geocodio,"2902 N Armenia Ave Ste 201 Tampa, FL 33607-1661","2902 N Armenia Ave, Ste 201, Tampa, FL 33607",1
Latino Coalition of Tampa Bay,1997,,FL,TAMPA,HILLSBOROUGH,Hybrid,27.996097,-82.582035,geocodio,"TAMPA, FL","Tampa, FL 33601",1
"The Center for Hispanic Policy, Research and Development",1975,"225 W State St, Trenton, New Jersey",NJ,TRENTON,MERCER,CSO,40.221766,-74.774083,geocodio,"225 W State St, Trenton, New Jersey","225 W State St, Trenton, NJ 08608",1
Coalition of Hispanic Organizations,2000,,OK,TULSA,TULSA,CSO,36.063095,-95.804231,geocodio,"TULSA, OK","Tulsa, OK 74102",1
Latino Advocates for Education,1974,,CA,TUSTIN,ORANGE,Hybrid,33.73401,-117.819157,geocodio,"TUSTIN, CA","Tustin, CA 92780",1
Hispanic-American Association of East Texas,1992,"1111 E Erwin St, Tyler, TX 75702",TX,TYLER,SMITH,CSO,32.350959,-95.2881,geocodio,"1111 E Erwin St, Tyler, TX 75702","1111 E Erwin St, Tyler, TX 75702",1
Latino Pac Foundation,2014,"Union City, NJ 07087-1028",NJ,UNION CITY,HUDSON,CSO,40.77955,-74.02375,geocodio,"Union City, NJ 07087-1028","Union City, NJ 07087",1
Great Lakes Bay Hispanic Leadership Institute,2009,,MI,UNIVERSITY CENTER,BAY,CSO,43.556574,-83.994328,geocodio,"UNIVERSITY CENTER, MI","University Center, MI 48710",1
Clark County Latino Youth Conference,2011,,WA,VANCOUVER,CLARK,CSO,45.678996,-122.720499,geocodio,"VANCOUVER, WA","Vancouver, WA 98660",1
Catholic Charities Diocese of Venice Catholic Hispanic Social Services,1968,,FL,VENICE,SARASOTA,CSO,27.09639,-82.433818,geocodio,"VENICE, FL","Venice, FL 34285",1
Latino Resource Organization,1983,"610 California Ave, Venice, CA 90291",CA,VENICE,LOS ANGELES,CSO,33.991584,-118.465386,geocodio,"610 California Ave, Venice, CA 90291","610 California Ave, Venice, CA 90291",1
ASPIRA Association,1961,"1444 I St NW #800, Washington, DC 20005",DC,WASHINGTON DC,DISTRICT OF COLUMBIA,CSO,38.901119,-77.03276,geocodio,"1444 I St NW #800, Washington, DC 20005","1444 I St NW, Ste 800, Washington, DC 20005",1
Central American Resource Center,1983,1460 Columbia Road Nw No C-1 Washington DC 20009-4764,DC,WASHINGTON DC,DISTRICT OF COLUMBIA,Advocacy,38.927186,-77.034526,geocodio,1460 Columbia Road Nw No C-1 Washington DC 20009-4764,"1460 Columbia Rd NW, Apt C1, Washington, DC 20009",1
Congressional Hispanic Caucus Institute,1976,"214 Cannon House Office Building,Washington, DC 20003",DC,WASHINGTON DC,DISTRICT OF COLUMBIA,Advocacy,38.881904,-76.990935,geocodio,"214 Cannon House Office Building,Washington, DC 20003","Washington, DC 20003",0.5
Congressional Hispanic Leadership Institute,2003,"734 15th Street, N.W. Suite 620, Washington, DC 20005-1030",DC,WASHINGTON DC,DISTRICT OF COLUMBIA,CSO,38.899586,-77.034079,geocodio,"734 15th Street, N.W. Suite 620, Washington, DC 20005-1030","734 15th St NW, Ste 620, Washington, DC 20005",1
Hispanic Access Foundation,2010,"1718 M Street Nw Suite 150 Washington, DC 20036-4054",DC,WASHINGTON DC,DISTRICT OF COLUMBIA,CSO,38.905803,-77.038738,geocodio,"1718 M Street Nw Suite 150 Washington, DC 20036-4054","1718 M St NW, Ste 150, Washington, DC 20036",1
Hispanic American Center for Economic Research,1996,"910 17th St NW #312, Washington, DC 20006",DC,WASHINGTON DC,DISTRICT OF COLUMBIA,Advocacy,38.901889,-77.039925,geocodio,"910 17th St NW #312, Washington, DC 20006","910 17th St NW, Ste 312, Washington, DC 20006",1
Hispanic Association on Corporate Responsibility,1986,,DC,WASHINGTON DC,DISTRICT OF COLUMBIA,Advocacy,38.921396,-76.993643,geocodio,"WASHINGTON DC, DC","Washington Pl NE, Washington, DC 20018",0.9
Hispanic College Fund,1993,"Washington, DC 20043-4636",DC,WASHINGTON DC,DISTRICT OF COLUMBIA,CSO,38.893311,-77.014647,geocodio,"Washington, DC 20043-4636","Washington, DC 20043",1
Hispanic Conservative Alliance,2015,,DC,WASHINGTON DC,DISTRICT OF COLUMBIA,Advocacy,38.921396,-76.993643,geocodio,"WASHINGTON DC, DC","Washington Pl NE, Washington, DC 20018",0.9
Hispanic Leadership Fund,2008,"1001 G St Nw Ste 800 Washington, DC 20001-4545",DC,WASHINGTON DC,DISTRICT OF COLUMBIA,Advocacy,38.898719,-77.026488,geocodio,"1001 G St Nw Ste 800 Washington, DC 20001-4545","1001 G St NW, Ste 800, Washington, DC 20001",1
Hispanic-Serving Health Professions Schools,1996,"2639 Connecticut Ave. NW, Ste. 203 Washington DC 20008",DC,WASHINGTON DC,DISTRICT OF COLUMBIA,CSO,38.924721,-77.05176,geocodio,"2639 Connecticut Ave. NW, Ste. 203 Washington DC 20008","2639 Connecticut Ave NW, Ste 203, Washington, DC 20008",1
Labor Council for Latin American Advancement,1972,"815 16th St. NW, 4th Fl Washington, DC 20006",DC,WASHINGTON DC,DISTRICT OF COLUMBIA,Advocacy,38.900869,-77.035994,geocodio,"815 16th St. NW, 4th Fl Washington, DC 20006","815 16th St NW, Fl 4, Washington, DC 20006",1
Latino Deaf and Hard of Hearing Agency of the Metropolitan DC Area,2005,,DC,WASHINGTON DC,DISTRICT OF COLUMBIA,CSO,38.921396,-76.993643,geocodio,"WASHINGTON DC, DC","Washington Pl NE, Washington, DC 20018",0.9
Latino Economic Development Corporation,1992,,DC,WASHINGTON DC,DISTRICT OF COLUMBIA,CSO,38.921396,-76.993643,geocodio,"WASHINGTON DC, DC","Washington Pl NE, Washington, DC 20018",0.9
Latino GLBT History Project,2000,2000 14th St Nw Ste 105 Washington DC 20009,DC,WASHINGTON DC,DISTRICT OF COLUMBIA,Advocacy,38.917577,-77.032517,geocodio,2000 14th St Nw Ste 105 Washington DC 20009,"2000 14th St NW, Ste 105, Washington, DC 20009",1
Latino Student Fund,1995,,DC,WASHINGTON DC,DISTRICT OF COLUMBIA,CSO,38.921396,-76.993643,geocodio,"WASHINGTON DC, DC","Washington Pl NE, Washington, DC 20018",0.9
League of United Latin American Citizens,1929,"1133 19th Street, NW, Suite 1000 Washington, DC 20036",DC,WASHINGTON DC,DISTRICT OF COLUMBIA,Advocacy,38.904791,-77.04294,geocodio,"1133 19th Street, NW, Suite 1000 Washington, DC 20036","1133 19th St NW, Ste 1000, Washington, DC 20036",1
LULAC National Educational Service Centers,1973,"1133 19th Street, NW, Suite 1000 Washington, DC 20036",DC,WASHINGTON DC,DISTRICT OF COLUMBIA,CSO,38.904791,-77.04294,geocodio,"1133 19th Street, NW, Suite 1000 Washington, DC 20036","1133 19th St NW, Ste 1000, Washington, DC 20036",1
"MANA, A National Latina Organization",1974,"1140 19th St. NW, Ste. 550 Washington, DC 20036",DC,WASHINGTON DC,DISTRICT OF COLUMBIA,Advocacy,38.904962,-77.043883,geocodio,"1140 19th St. NW, Ste. 550 Washington, DC 20036","1140 19th St NW, Ste 550, Washington, DC 20036",1
National Alliance for Hispanic Health,1973,"1501 16th St. NW Washington, DC 20036 ",DC,WASHINGTON DC,DISTRICT OF COLUMBIA,CSO,38.910384,-77.036521,geocodio,"1501 16th St. NW Washington, DC 20036","1501 16th St NW, Washington, DC 20036",1
National Community for Latino Leadership,1989,1701 K Street Northwest Washington DC 20006,DC,WASHINGTON DC,DISTRICT OF COLUMBIA,CSO,38.902812,-77.038786,geocodio,1701 K Street Northwest Washington DC 20006,"1701 K St NW, Washington, DC 20006",1
National Council of La Raza,1968,1126 16th St Nw 6th Fl Washington DC 20036-4804,DC,WASHINGTON DC,DISTRICT OF COLUMBIA,Advocacy,38.904498,-77.03698,geocodio,1126 16th St Nw 6th Fl Washington DC 20036-4804,"1126 16th St NW, Fl 6, Washington, DC 20036",1
National Hispanic Council on Aging,1980,"734 15th St Nw Ste 1050 Washington, DC 20005-1038",DC,WASHINGTON DC,DISTRICT OF COLUMBIA,Hybrid,38.899586,-77.034079,geocodio,"734 15th St Nw Ste 1050 Washington, DC 20005-1038","734 15th St NW, Ste 1050, Washington, DC 20005",1
National Hispanic Council on Aging Housing of Dist of Columbia,1994,2713 Ontario Road Nw Ste 200 Washington DC 20009-8838,DC,WASHINGTON DC,DISTRICT OF COLUMBIA,CSO,38.924857,-77.04029,geocodio,2713 Ontario Road Nw Ste 200 Washington DC 20009-8838,"2713 Ontario Rd NW, Ste 200, Washington, DC 20009",1
National Hispanic Health Foundation,1994,"1411 K St Nw Ste 1100 Washington, DC 20005-3461",DC,WASHINGTON DC,DISTRICT OF COLUMBIA,CSO,38.902932,-77.032564,geocodio,"1411 K St Nw Ste 1100 Washington, DC 20005-3461","1411 K St NW, Ste 1100, Washington, DC 20005",1
National Latina Health Network,1989,"2201 Washington Ave. NW, Ste. 340, Washington, DC 20007",DC,WASHINGTON DC,DISTRICT OF COLUMBIA,CSO,38.902939,-77.049332,geocodio,"2201 Washington Ave. NW, Ste. 340, Washington, DC 20007","2211 Washington Cir NW, Ste 340, Washington, DC 20037",0.81
"National Latino/Latina Lesbian, Gay, Bisexual and Transgender Organization",1987,"Northwest, Washington, DC 20006",DC,WASHINGTON DC,DISTRICT OF COLUMBIA,CSO,38.907242,-77.038116,geocodio,"Northwest, Washington, DC 20006","N St NW, Washington, DC 20036",0.77
Strategic Investment Fund for La Raza,2001,"1126 16TH STREET NW WASHINGTON , DC 20036",DC,WASHINGTON DC,DISTRICT OF COLUMBIA,CSO,38.904498,-77.03698,geocodio,"1126 16TH STREET NW WASHINGTON , DC 20036","1126 16th St NW, Washington, DC 20036",1
"Unid@s, The National Latina/Latino LGBT Human Rights Organization",2007,,DC,WASHINGTON DC,DISTRICT OF COLUMBIA,Advocacy,38.921396,-76.993643,geocodio,"WASHINGTON DC, DC","Washington Pl NE, Washington, DC 20018",0.9
Voto Latino,2004,,DC,WASHINGTON DC,DISTRICT OF COLUMBIA,Advocacy,38.921396,-76.993643,geocodio,"WASHINGTON DC, DC","Washington Pl NE, Washington, DC 20018",0.9
Hispanic Coalition of Greater Waterbury,1972,"135 E Liberty St # 5, Waterbury, CT 06706",CT,WATERBURY,NEW HAVEN,CSO,41.547917,-73.034271,geocodio,"135 E Liberty St # 5, Waterbury, CT 06706","135 E Liberty St, # 5, Waterbury, CT 06706",1
Madre Latina,2011,,CT,WATERBURY,NEW HAVEN,CSO,41.556461,-73.045886,geocodio,"WATERBURY, CT","Waterbury, CT 06702",1
El Puente Latino,2008,,IL,WAUKEGAN,LAKE,CSO,42.352097,-87.867656,geocodio,"WAUKEGAN, IL","Waukegan, IL 60085",1
Hispanic American Community Education and Services,2005,"641 Lorraine Ave Waukegan, IL 60085-3645",IL,WAUKEGAN,LAKE,CSO,42.36985,-87.85277,geocodio,"641 Lorraine Ave Waukegan, IL 60085-3645","641 Lorraine Ave, Waukegan, IL 60085",1
La Casa De Esperanza,1979,"410 Arcadian Avenue, Waukesha, WI 53186",MN,WAUKESHA,WABASHA,CSO,43.012368,-88.222994,geocodio,"410 Arcadian Avenue, Waukesha, WI 53186","410 Arcadian Ave, Waukesha, WI 53186",1
Latino Family Institute,1997,"1501 W Cameron Ave Ste 240 West Covina, CA 91790-2733 ",CA,WEST COVINA,LOS ANGELES,CSO,34.068772,-117.940973,geocodio,"1501 W Cameron Ave Ste 240 West Covina, CA 91790-2733","1501 W Cameron Ave, Ste 240, West Covina, CA 91790",1
Institute for Latino Studies Research and Development,2001,,NJ,WEST MILFORD,PASSAIC,CSO,41.1053,-74.39094,geocodio,"WEST MILFORD, NJ","West Milford, NJ 07480",1
Hispanic Education Coalition of Palm Beach County,2016,"3006 S DIXIE HWY WEST PALM BCH, FL 33405 ",FL,WEST PALM BEACH,PALM BEACH,Hybrid,26.686696,-80.054209,geocodio,"3006 S DIXIE HWY WEST PALM BCH, FL 33405","3006 S Dixie Hwy, West Palm Beach, FL 33405",1
Hispanic Human Resources Council,1977,"1427 S Congress Ave West Palm Bch, FL 33406-5120",FL,WEST PALM BEACH,PALM BEACH,CSO,26.655768,-80.08859,geocodio,"1427 S Congress Ave West Palm Bch, FL 33406-5120","1427 S Congress Ave, West Palm Beach, FL 33406",1
Latino Health Community,2014,,FL,WESTON,BROWARD,CSO,26.11363,-80.41699,geocodio,"WESTON, FL","Weston, FL 33327",1
Latino U College Access,2013,"75 Virginia Rd, White Plains, NY 10603",NY,WHITE PLAINS,WESTCHESTER,CSO,41.06512,-73.776408,geocodio,"75 Virginia Rd, White Plains, NY 10603","75 Virginia Rd, White Plains, NY 10603",1
Westchester Hispanic Coalition,1975,"46 Waller Avenue, White Plains, NY 10605",NY,WHITE PLAINS,WESTCHESTER,CSO,41.027798,-73.763033,geocodio,"46 Waller Avenue, White Plains, NY 10605","46 Waller Ave, White Plains, NY 10605",1
Hispanic Outreach Taskforce,1990,6706 Friends Ave Whittier CA 90601-4432,CA,WHITTIER,LOS ANGELES,CSO,33.980651,-118.033545,geocodio,6706 Friends Ave Whittier CA 90601-4432,"6706 Friends Ave, Whittier, CA 90601",1
Latino Community Diabetes Council,2014,,CA,WHITTIER,LOS ANGELES,CSO,34.004311,-118.0441,geocodio,"WHITTIER, CA","Whittier, CA 90601",1
Latino Scholastic Achievement Corporation,1992,"11616 Ridgegate Dr, Whitter , CA 90601",CA,WHITTIER,LOS ANGELES,CSO,34.005615,-118.041274,geocodio,"11616 Ridgegate Dr, Whitter , CA 90601","11616 Ridgegate Dr, Whittier, CA 90601",1
Kansas Hispanic Education and Development Foundation,2007,"Wichita, KS 67204-0248",KS,WICHITA,SEDGWICK,CSO,37.787925,-97.381233,geocodio,"Wichita, KS 67204-0248","Wichita, KS 67204",1
Diamond Hispanic Network,2013,,CA,WINCHESTER,RIVERSIDE,CSO,33.71691,-117.07357,geocodio,"WINCHESTER, CA","Winchester, CA 92596",1
Latino Service Providers,1989,930 Shiloh Road Bldg 40 Ste A Windsor CA 95492-6619,CA,WINDSOR,SONOMA,CSO,38.524265,-122.795358,geocodio,930 Shiloh Road Bldg 40 Ste A Windsor CA 95492-6619,"930 Shiloh Rd, Bldg 40F, Windsor, CA 95492",1
